{
  "$schema": "https://json-schema.org/draft/2020-12/schema",
  "title": "Plan",
  "type": "object",
  "required": [
    "schema_version",
    "task_id",
    "steps",
    "verify_plan"
  ],
  "properties": {
    "schema_version": {
      "type": "string",
      "const": "0.2"
    },
    "task_id": {
      "type": "string"
    },
    "steps": {
      "type": "array",
      "items": {
        "type": "object",
        "required": [
          "id",
          "objective",
          "expected_output",
          "verification",
          "fulfills"
        ],
        "properties": {
          "id": {
            "type": "string"
          },
          "objective": {
            "type": "string"
          },
          "dependencies": {
            "type": "array",
            "items": {
              "type": "string"
            }
          },
          "expected_output": {
            "type": "string"
          },
          "verification": {
            "type": "string"
          },
          "rollback_note": {
            "type": "string"
          },
          "fulfills": {
            "type": "array",
            "minItems": 1,
            "items": {
              "type": "string"
            }
          },
          "status": {
            "type": "string",
            "enum": [
              "pending",
              "in_progress",
              "completed",
              "failed",
              "blocked"
            ]
          },
          "source": {
            "type": "string",
            "enum": [
              "nlp_draft",
              "human",
              "agent_refined",
              "imported"
            ],
            "description": "Provenance for this step. nlp_draft means the step came from deterministic natural-language extraction and needs reviewer skepticism."
          }
        },
        "additionalProperties": false
      }
    },
    "contracts": {
      "type": "object",
      "required": [
        "artifact",
        "interfaces",
        "invariants"
      ],
      "properties": {
        "artifact": {
          "type": [
            "string",
            "null"
          ]
        },
        "interfaces": {
          "type": "array",
          "items": {
            "type": "string"
          }
        },
        "invariants": {
          "type": "array",
          "items": {
            "type": "string"
          }
        }
      },
      "additionalProperties": false
    },
    "journeys": {
      "type": "array",
      "items": {
        "type": "object",
        "required": [
          "id",
          "description",
          "composes"
        ],
        "properties": {
          "id": {
            "type": "string"
          },
          "description": {
            "type": "string"
          },
          "composes": {
            "type": "array",
            "items": {
              "type": "string"
            }
          }
        },
        "additionalProperties": false
      }
    },
    "verify_plan": {
      "type": "array",
      "minItems": 1,
      "items": {
        "type": "object",
        "required": [
          "target",
          "type",
          "gates"
        ],
        "properties": {
          "target": {
            "type": "string"
          },
          "type": {
            "type": "string",
            "enum": [
              "sub_req",
              "journey",
              "step"
            ]
          },
          "gates": {
            "type": "array",
            "items": {
              "type": [
                "string",
                "integer"
              ]
            }
          }
        },
        "additionalProperties": false
      }
    }
  },
  "additionalProperties": false
}
