{
  "schema_version": "0.2",
  "task_id": "task-ui-header-copy-001",
  "steps": [
    {
      "id": "step-1",
      "objective": "README와 architecture 문서의 핵심 메시지를 비교한다.",
      "dependencies": [],
      "expected_output": "충돌 여부와 수정 대상 문서 목록",
      "verification": "README와 architecture 핵심 문장을 나란히 읽고 목적/정체성이 일치하는지 확인한다.",
      "rollback_note": "핵심 표현이 흔들리면 기존 README 표현으로 되돌린다.",
      "fulfills": [
        "doc-message-consistency"
      ]
    },
    {
      "id": "step-2",
      "objective": "문구를 artifact-first delivery harness 기준으로 통일한다.",
      "dependencies": [
        "step-1"
      ],
      "expected_output": "README/docs 문구 통일",
      "verification": "workflow, artifact-model, adapter-model에서 같은 정체성이 반복되는지 확인한다.",
      "rollback_note": "runtime 범위를 넓히는 문구가 생기면 제거한다.",
      "fulfills": [
        "doc-message-consistency"
      ]
    }
  ],
  "contracts": {
    "artifact": "contracts.md",
    "interfaces": [
      "Documentation messaging stays consistent across README and architecture docs"
    ],
    "invariants": [
      "Do not expand runtime scope while updating copy"
    ]
  },
  "journeys": [
    {
      "id": "journey-doc-consistency",
      "description": "Reader sees consistent ForgeFlow positioning across docs",
      "composes": [
        "doc-message-consistency"
      ]
    }
  ],
  "verify_plan": [
    {
      "target": "doc-message-consistency",
      "type": "sub_req",
      "gates": [
        "manual-doc-review"
      ]
    },
    {
      "target": "journey-doc-consistency",
      "type": "journey",
      "gates": [
        "cross-doc-review"
      ]
    }
  ]
}
